{
  "SetOne": [
    {
      "id": 1,
      "value": "conformity",
      "question": "You believe you should always show respect to your parents and to older people. It is important to you to be obedient."
    },
    {
      "id": 2,
      "value": "tradition",
      "question": "Religious belief is important to you. You want your faith or family traditions to guide your decisions and be a core part of your life."
    },
    {
      "id": 3,
      "value": "benevolence",
      "question": "It’s very important to you to help the people around you. You want to care for their well-being."
    },
    {
      "id": 4,
      "value": "universalism",
      "question": "You think it is important that every person in the world be treated equally. You believe everyone should have equal opportunities in life."
    },
    {
      "id": 5,
      "value": "self-direction",
      "question": "You think it’s important to be interested in things. You like to be curious and to try to understand all sorts of things."
    },
    {
      "id": 6,
      "value": "stimulation",
      "question": "You like to take risks. You are always looking for adventures."
    },
    {
      "id": 7,
      "value": "hedonism",
      "question": "You seek every chance you can to have fun. It is important to you to do things that give you pleasure."
    },
    {
      "id": 8,
      "value": "achievement",
      "question": "Getting ahead in life is important to you. You strive to do better than others."
    },
    {
      "id": 9,
      "value": "power",
      "question": "You always want to be the one who makes the decisions. You like to be the leader."
    },
    {
      "id": 10,
      "value": "security",
      "question": "Having a stable government is important to you. You are concerned that the social order is protected."
    }
  ],
  "SetTwo": [
    {
      "id": 1,
      "value": "conformity",
      "question": "It is important to you to always behave properly. You want to avoid doing anything people would say is wrong."
    },
    {
      "id": 2,
      "value": "tradition",
      "question": "You think it is best to do things in traditional ways. It is important to you to do things the way you were taught to do them."
    },
    {
      "id": 3,
      "value": "benevolence",
      "question": "It is important to you to respond to the needs of others. You try to support those you know."
    },
    {
      "id": 4,
      "value": "universalism",
      "question": "You believe all the worlds’ people should live in harmony. Promoting peace among all groups in the world is important to you."
    },
    {
      "id": 5,
      "value": "self-direction",
      "question": "Thinking up new ideas and being creative is important to you. You like to do things in your own original way."
    },
    {
      "id": 6,
      "value": "stimulation",
      "question": "You think it is important to do lots of different things in life. You always looks for new things to try."
    },
    {
      "id": 7,
      "value": "hedonism",
      "question": "You really want to enjoy life. Having a good time is very important to you."
    },
    {
      "id": 8,
      "value": "achievement",
      "question": "Being very successful is important to you. You like to impress other people."
    },
    {
      "id": 9,
      "value": "power",
      "question": "It is important to you to be in charge and tell others what to do. You want people to do what you say."
    },
    {
      "id": 10,
      "value": "security",
      "question": "It is important to you that things be organized and clean. You really do not like things to be a mess."
    }
  ],

  "Answers": [
    { "id": 1, "text": "Not Like Me At All" },
    { "id": 2, "text": "Not Like Me" },
    { "id": 3, "text": "Little Like Me" },
    { "id": 4, "text": "Somewhat Like Me" },
    { "id": 5, "text": "Like Me" },
    { "id": 6, "text": "Very Much Like Me" }
  ],
  "Directions": "Here we briefly describe statements about you. Please read each description and think about how much that statement is or is not like you."
}
